url,title,summary
https://www.nhk.or.jp/rss/news/cat1.xml,道央自動車道 観光バスがIC分岐帯に衝突 18人痛み訴え 北海道,8日午前、北海道鷹栖町の道央自動車道の下りで、観光バスがインターチェンジの「分岐帯」に衝突し、乗っていた18人が体の痛みを訴えました。警察が詳しい状況を調べています。
https://www.nhk.or.jp/rss/news/cat1.xml,千葉県警の元警部 現職時の性的暴行疑い 5回目の逮捕,女性への性的暴行や盗撮の疑いで逮捕・起訴され、懲戒免職となった千葉県警察本部の元警部が現職の警察官だった時に、ほかにも性的暴行をしていた疑いがあることが分かり、逮捕されました。元警部が逮捕されるのは5回目です。
https://www.nhk.or.jp/rss/news/cat1.xml,“物価の優等生”卵も値上がり おせち料理は3割値上げの店も,「物価の優等生」とも言われ、この時期、クリスマスケーキや鍋物の具材などに欠かせない卵が値上がりしています。ニワトリの餌となるとうもろこしの価格高騰や鳥インフルエンザの急拡大によるもので、生活に身近な商品の価格上昇が続いています。
https://www.nhk.or.jp/rss/news/cat1.xml,大阪府 新型コロナ 9人死亡 新たに6950人感染確認,厚生労働省は8日、大阪府内で新たに6950人が新型コロナウイルスに感染していることを確認したと発表しました。これで大阪府内の感染者の累計は233万5117人となりました。また、9人の死亡が発表され、府内で感染して亡くなった人は合わせて6802人となっています。重症者は40人と7日より4人多くなっています。
https://www.nhk.or.jp/rss/news/cat1.xml,【新型コロナ 厚労省まとめ】243人死亡 13万3065人感染 (8日),厚生労働省によりますと、8日に発表した国内の新たな感染者は、空港の検疫などを含め13万3065人となっています。また国内で亡くなった人は、北海道で34人、東京都で20人、神奈川県で16人、愛知県で15人、埼玉県で13人、長野県で12人、宮城県で11人、兵庫県で10人、千葉県で9人、大阪府で9人、三重県で7人、岡山県で6人、秋田県で6人、奈良県で5人、愛媛県で5人、茨城県で5人、山梨県で4人、岐阜県で4人、岩手県で4人、広島県で4人、熊本県で4人、青森県で4人、和歌山県で3人、福岡県で3人、福島県で3人、群馬県で3人、香川県で3人、京都府で2人、大分県で2人、山口県で2人、島根県で2人、栃木県で2人、石川県で2人、長崎県で2人、静岡県で2人、高知県で2人、山形県で1人、滋賀県で1人、鹿児島県で1人の合わせて243人、累計で5万1062人となっています。
https://www.nhk.or.jp/rss/news/cat1.xml,東京都 新型コロナ 20人死亡 1万4104人感染 前週比1772人増,厚生労働省は8日、都内で新たに1万4104人が新型コロナウイルスに感染していることを確認したと発表しました。1週間前の木曜日より1772人増えました。前の週の同じ曜日を上回るのは3日連続です。また、人工呼吸器か、ECMO＝人工心肺装置を使っている重症の患者は、7日より2人減り、17人でした。一方、感染が確認された20人が死亡しました。
https://www.nhk.or.jp/rss/news/cat1.xml,東京 葛飾区の印刷工場で火災 消防によると1人けが,8日午後、東京 葛飾区の印刷工場から火が出て、建物の1階と2階部分が焼け、消防が消火活動を行っています。
https://www.nhk.or.jp/rss/news/cat1.xml,名古屋 女子大生死亡 一緒にホテル滞在 男女3人逮捕 殺人疑い,6日、名古屋市のホテルの部屋で、20歳の大学生の女性が頭に袋のようなものをかぶった状態で死亡しているのが見つかった事件で、警察は女性と一緒にホテルに滞在していた男女3人を殺人の疑いで逮捕しました。警察は死亡のいきさつや4人の関係性など捜査を進めています。
https://www.nhk.or.jp/rss/news/cat1.xml,多摩都市モノレール延伸 2030年代半ばの開業目指す 東京都,多摩都市モノレールの東大和市から瑞穂町までの延伸について、都は2030年代半ばの開業を目指すことを明らかにしました。
https://www.nhk.or.jp/rss/news/cat1.xml,真珠湾攻撃81年 戦争の記憶継承に “バーチャル資料館” 東京,太平洋戦争の発端となった真珠湾攻撃から12月8日で81年です。戦争の記憶の継承に取り組む東京 新宿区の資料館は、若い世代やコロナ禍で外出を控えている人などに向けて、インターネット上で館内の展示を疑似的に見学できる新たな取り組みを始めました。
https://www.nhk.or.jp/rss/news/cat1.xml,11月の景気ウォッチャー調査 4か月ぶりに悪化 物価高が影響,働く人に景気の実感を聞く内閣府の11月の景気ウォッチャー調査は、物価高の影響などにより、景気の現状を示す指数が4か月ぶりに悪化しました。
https://www.nhk.or.jp/rss/news/cat1.xml,警察署で20年以上容疑者などの散髪 理容師に感謝状 新潟 燕,新潟県燕市に、20年以上にわたって警察署の「理髪室」で、容疑者などの散髪をしてきた理容師がいます。「理髪室」が老朽化で閉鎖されるのを前に、理容師に感謝状が贈られました。
https://www.nhk.or.jp/rss/news/cat1.xml,「NHK障害福祉賞」最優秀賞は栃木の17歳高校生 過去最年少,障害のある人やその家族などがつづった優れた体験記に贈られる「NHK障害福祉賞」の贈呈式が、東京 渋谷のNHK放送センターで行われました。
https://www.nhk.or.jp/rss/news/cat1.xml,憲法改正の国民投票 ネット広告扱いは 衆院憲法審で参考人質疑,衆議院憲法審査会では8日、憲法改正の国民投票が行われる際に、インターネット広告をどう扱うかをめぐって参考人質疑が行われました。
https://www.nhk.or.jp/rss/news/cat1.xml,コリア国際学園で火つけた罪など 被告に猶予つき懲役3年の判決,大阪 茨木市にあるインターナショナルスクール「コリア国際学園」に侵入し、段ボールに火をつけた罪などに問われた、30歳の被告に対し、大阪地方裁判所は「ゆがんだ正義感にもとづく独善的な動機だ」と指摘し、執行猶予のついた懲役3年の判決を言い渡しました。
https://www.nhk.or.jp/rss/news/cat1.xml,10日から「国際賢人会議」 被爆者「広島からの叫び 話したい」,海外から有識者などを招いて核軍縮に向けた議論を行う、「国際賢人会議」が、10日から被爆地 広島で開かれます。会議で原爆被害の実相を訴える被爆者は、ウクライナへの軍事侵攻などを踏まえて「生まれてきた以上は、平和な暮らしがしたいと思う。いつ戦争が起こるか分からないから核兵器を持っていなくてはいけないという考え方が続くのなら、非常に悲しい」と語りました。
https://www.nhk.or.jp/rss/news/cat1.xml,アップル クラウドで管理のデータ暗号化へ セキュリティー強化,アメリカのIT大手、アップルは、クラウド上で管理しているデータを暗号化する新たなセキュリティー強化策を明らかにしました。こうした対策は各国での事件の捜査に支障をきたす可能性もあり、議論を呼ぶことになりそうです。
https://www.nhk.or.jp/rss/news/cat1.xml,ウーバーイーツ運営会社 労組との団交の命令に再審査申し立て,料理のデリバリーを行う「ウーバーイーツ」の運営会社に対し、東京の労働委員会が、配達員で作る労働組合との団体交渉に応じるよう命じたことについて、運営会社は、不服があるとして、中央労働委員会に再審査を申し立てました。
https://www.nhk.or.jp/rss/news/cat1.xml,原子力発電の最大限活用へ「行動指針」まとめる 経済産業省,政府が掲げる原子力発電の最大限の活用に向けて、経済産業省は、次世代型の原子炉への建て替えや、原発の運転期間の実質的な延長などを盛り込んだ「行動指針」をまとめました。
https://www.nhk.or.jp/rss/news/cat1.xml,旧統一教会被害者救済法案 修正加えたうえ衆院特別委で可決,旧統一教会の被害者救済を図る法案は、衆議院の特別委員会で、寄付の勧誘を行う法人などに課す配慮義務を怠った場合に、法人名を公表するなどの修正を加えたうえで採決が行われ、自民・公明両党や立憲民主党などの賛成多数で可決されました。法案は、衆議院本会議で可決される見通しです。
https://www.nhk.or.jp/rss/news/cat1.xml,防衛相 “「スタンド・オフ・ミサイル」潜水艦発射型が有用”,敵の射程圏外から攻撃できる「スタンド・オフ・ミサイル」をめぐり、浜田防衛大臣は、潜水艦から発射するタイプは、相手に一層複雑な対応を強いることができて有用だとして、開発に向けた検討を進める考えを示しました。
https://www.nhk.or.jp/rss/news/cat1.xml,顧客口座から約100万円を別口座に送金させ詐取か 元銀行員逮捕,おととし、32歳の元銀行員が顧客だった女性の口座から、現金およそ100万円を別の口座に送金させてだまし取ったとして逮捕されました。警視庁は元行員が合わせて数千万円を送金させて引き出していたとみて調べています。
https://www.nhk.or.jp/rss/news/cat1.xml,“一人で悩まないで” 職場の悩みに応じる無料の電話相談 連合,コロナ禍や原材料価格の高騰で企業を取り巻く環境が変わり、働く人への影響も懸念される中、職場の悩みに無料で応じる電話相談が全国一斉に行われています。
https://www.nhk.or.jp/rss/news/cat1.xml,旧統一教会被害者救済法案可決へ 首相“成立後も見直し検討”,岸田総理大臣は、旧統一教会の被害者救済を図る法案を審議する衆議院の特別委員会で、法案の成立後も執行状況などを見極め、実効性を高める見直しを検討する考えを示しました。法案はこのあと一部修正を加えたうえで、自民・公明両党と立憲民主党などの賛成多数で可決される見通しです。
https://www.nhk.or.jp/rss/news/cat1.xml,JR京浜東北線 運転再開,JR京浜東北線は人身事故のため全線で運転を見合わせていましたが、午前8時20分ごろ、運転を再開しました。
https://www.nhk.or.jp/rss/news/cat1.xml,JR湘南新宿ライン 宇都宮線 高崎線 運転再開,JR東日本によりますと、埼玉県にあるJR京浜東北線の北浦和駅で起きた人身事故のため、京浜東北線と宇都宮線、高崎線の全線、それに、湘南新宿ラインの新宿駅から北の上下線で、運転を見合わせていましたが、午前7時40分の時点で京浜東北線を除き運転を再開しました。
https://www.nhk.or.jp/rss/news/cat1.xml,JR京浜東北線 湘南新宿ライン 宇都宮線 高崎線 運転見合わせ,JR京浜東北線は、午前7時すぎに埼玉県の北浦和駅で起きた人身事故のため全線で運転を見合わせています。また、この影響で、▽湘南新宿ラインが新宿駅から北の上下線で、▽宇都宮線と高崎線がそれぞれ全線で運転を見合わせています。運転再開は午前8時10分ごろを見込んでいるということです。
https://www.nhk.or.jp/rss/news/cat1.xml,新たな変異ウイルスに対する飲み薬効果確認 東大研究グループ,新型コロナウイルスのオミクロン株のうち、国内でも検出される割合が増えてきている「BQ.1.1」などの新たな変異ウイルスに対して、飲み薬の効果が確認できたとする実験結果を東京大学の研究グループが発表しました。
https://www.nhk.or.jp/rss/news/cat1.xml,相次ぐ不適切な保育 厚労省が自治体に対応徹底求める通知,静岡県裾野市の保育園で元保育士3人が園児に暴行したとして逮捕された事件を受け、厚生労働省は不適切な保育が疑われるケースがわかった時点で速やかに自治体に報告するなど対応の徹底を求める通知を出しました。
https://www.nhk.or.jp/rss/news/cat1.xml,長さ7.8mの「ダイオウイカ」 沖縄 多良間島沖合で釣り上げる,沖縄県の多良間島の沖合で、深海に生息する巨大イカの「ダイオウイカ」を地元の漁業者の男性が釣り上げました。
https://www.nhk.or.jp/rss/news/cat1.xml,新型コロナ「第7波」自宅で死亡776人 8割近くが70代以上,新型コロナウイルスの「第7波」で感染が拡大したことし7月と8月の2か月間に感染して自宅で亡くなった人は全国で少なくとも776人に上り、このうち8割近くを70代以上が占めたことが厚生労働省のまとめでわかりました。
https://www.nhk.or.jp/rss/news/cat1.xml,ボウリング場でピンを並べる機械に挟まれ従業員重体 兵庫 西宮,7日夜、兵庫県西宮市のボウリング場で40代の従業員の男性がピンを自動で並べる機械に挟まれて意識不明の重体となり、警察が当時の詳しい状況や原因を調べています。
https://www.nhk.or.jp/rss/news/cat1.xml,東京 練馬区 死亡ひき逃げ事件 69歳の大工を逮捕,今月、東京 練馬区の路上で70代の男性が車にはねられて死亡したひき逃げ事件で、警視庁は69歳の大工を危険運転致死などの疑いで逮捕しました。調べに対し、容疑を一部否認しているということです。
https://www.nhk.or.jp/rss/news/cat1.xml,航空自衛隊を「航空宇宙自衛隊」に名称変更へ 政府方針,宇宙領域での安全保障の重要性が増していることを踏まえ、政府は航空自衛隊の名称を「航空宇宙自衛隊」に変更することを、年末までに改定する「国家安全保障戦略」などに盛り込む方針を固めました。名称が変われば、昭和29年に陸海空の自衛隊が発足してから初めてとなります。
https://www.nhk.or.jp/rss/news/cat4.xml,日豪 外務・防衛閣僚協議 中国の力による現状変更の試みに反対,日本とオーストラリアの外務・防衛の閣僚協議が行われ、中国による東シナ海などでの力を背景にした現状変更の試みに反対するとともに、両国の安全保障面での協力の具体化で一致しました。
https://www.nhk.or.jp/rss/news/cat4.xml,Jアラート「都道府県単位」見直しを検討 情報発信の迅速化へ,北朝鮮の弾道ミサイル発射時に警戒情報を発信するJアラートについて、政府は、今の都道府県単位を改め、隣接する都道府県も含めたより広い範囲ごとに行う方式に見直す案を検討していることが分かりました。対象地域を絞り込む分析にかかっている時間を省くことで、情報発信を迅速化するねらいがあります。
https://www.nhk.or.jp/rss/news/cat4.xml,旧統一教会 被害者救済法案 参院で参考人質疑 10日に成立へ,旧統一教会の被害者救済を図る、新たな法案を審議している参議院の特別委員会では9日午後、参考人質疑が行われ、法案が成立したあとも、実効性を高めるための取り組みや、法律の見直しに向けた検討を求める意見が相次ぎました。
https://www.nhk.or.jp/rss/news/cat4.xml,”安保3文書”全容判明 スタンド・オフ防衛能力に約5兆円など,政府が改定する「国家安全保障戦略」などの3つの文書の全容が明らかになりました。来年度から5年間の防衛費、およそ43兆円の内訳として、敵の射程圏外から攻撃できる「スタンド・オフ防衛能力」の分野におよそ5兆円、宇宙やサイバーの分野にそれぞれおよそ1兆円など前回の計画を大幅に上回る予算が計上されています。
https://www.nhk.or.jp/rss/news/cat4.xml,千葉 松戸市の維新市議 約60人分の個人情報を目的外使用で謝罪,千葉県松戸市の日本維新の会の市議会議員が、市の青少年相談員の立場で把握したおよそ60人分の個人情報が、ことし夏の参議院選挙に立候補を予定していた候補者の事務所に提供され、選挙活動に使われていたことが分かりました。個人情報の目的外の使用に当たり市議会議員は謝罪しました。
https://www.nhk.or.jp/rss/news/cat4.xml,官房長官 杉田水脈政務官の“アイヌ差別投稿” 本人が説明を,杉田水脈・総務政務官が、アイヌの人たちを差別する内容をブログに投稿していたとして、市民グループが罷免を求めていることについて、松野官房長官は、本人が引き続き説明を尽くしていくべきだという認識を示しました。
https://www.nhk.or.jp/rss/news/cat4.xml,防衛費増額“財源に増税” 自民 政務調査会で慎重な意見相次ぐ,防衛費の増額をめぐり、岸田総理大臣が不足する財源を賄うため、与党に増税の検討を指示したことを受けて、自民党の政務調査会の全体会議が開かれ、出席者からは、増税に理解を示す声が出た一方、拙速な増税の議論に反対や慎重な意見が相次ぎました。
https://www.nhk.or.jp/rss/news/cat4.xml,“重要インフラにサイバー攻撃”想定 関係省庁の担当者が演習,来年の「G7広島サミット」を控えてサイバー攻撃への懸念が高まる中、電気やガスなど重要なインフラがサイバー攻撃を受けたことなどを想定した演習が行われ、関係省庁の担当者などが復旧に向けた手順などを確認しました。
https://www.nhk.or.jp/rss/news/cat4.xml,与野党国対委員長会談 野党側 閣僚辞任や与党側の国会対応批判,今の国会が10日に会期末を迎えるのを前に、与野党6党の国会対策委員長が会談し、野党側は、閣僚の辞任が相次いだうえ、その後の与党側の国会対応にも問題があったと批判しました。
https://www.nhk.or.jp/rss/news/cat4.xml,“中国警察の主権侵害”日本であれば容認できず 政府申し入れ,中国の警察が各国に出先事務所を開設し、現地の中国人に圧力をかけている可能性もあると報じられたことをめぐり、政府は、仮に日本でも主権を侵害するような活動が行われているのであれば断じて容認できないと、外交ルートを通じて中国側に申し入れたことを明らかにしました。
https://www.nhk.or.jp/rss/news/cat4.xml,被害者救済法案の条文修正めぐり 立民と国民 両党間の応酬続く,旧統一教会の被害者救済を図る新たな法案の条文の修正を「言葉遊び」と指摘した国民民主党の玉木代表に、立憲民主党が撤回を求めた文書の表現について、国民民主党の榛葉幹事長は「失礼だ」と反論し、両党間の応酬が続いています。
https://www.nhk.or.jp/rss/news/cat4.xml,後期高齢者の年間保険料 2年後 約5400円の負担増 厚労省が試算,75歳以上の人が加入する後期高齢者医療制度について、厚生労働省は2年後の2024年度の年間保険料が、1人当たりの平均でおよそ5400円増えるとした試算を示しました。
https://www.nhk.or.jp/rss/news/cat4.xml,利用者減少の公共交通 “再構築に国の財政措置を” 地方財政審,利用者の減少が課題となっている地域の公共交通機関について、総務大臣の諮問機関 地方財政審議会は、公共交通ネットワークの再構築を進めるため、国が必要な財政措置を講じるべきだなどとする意見書をまとめました。
https://www.nhk.or.jp/rss/news/cat4.xml,“増税検討” 鈴木財務相「国民の理解得られるよう説明必要」,防衛費の増額で不足する財源を賄うため、政府・与党が増税を検討していることについて、鈴木財務大臣は国民の理解が得られるよう、丁寧に説明する必要があるという認識を示しました。
https://www.nhk.or.jp/rss/news/cat4.xml,衆院“ほとんど審議ない特別委” 来年の通常国会までに改革案,衆議院の特別委員会の中にほとんど審議が行われていない委員会があるという指摘を受けて、与野党は来年の通常国会までに、改革案をまとめることになりました。
https://www.nhk.or.jp/rss/news/cat4.xml,国民 玉木代表 反撃能力の保持や防衛費の増額 岸田首相に提言,防衛力の抜本的な強化に向けて、国民民主党の玉木代表は岸田総理大臣と会談し、日本独自の反撃能力の保持や、10年程度かけて防衛費を増額することなどを求める提言を申し入れました。
https://www.nhk.or.jp/rss/news/cat4.xml,旧統一教会めぐり文科省が“宗教2世”から意見聞き取り 文科相,旧統一教会をめぐる問題で、永岡文部科学大臣は、いわゆる宗教2世の人たちから意見の聞き取りを行っていると明らかにしました。文部科学省は、教会への質問権の行使で得られた情報に加え、宗教2世や弁護士からの意見を踏まえ、教会に対する解散命令を請求するかどうか判断することにしています。
https://www.nhk.or.jp/rss/news/cat4.xml,ODAの指針「大綱」8年ぶり見直しへ 有識者懇談会が報告書提出,来年のODA＝政府開発援助の指針を定めた「大綱」の見直しに向けて、有識者の懇談会が報告書をまとめました。経済安全保障の強化などへの協力を重視すべきとしたほか、予算規模の倍増などで目標達成に向けた道筋を明らかにすべきだとしています。
https://www.nhk.or.jp/rss/news/cat4.xml,信者どうしの養子縁組 旧統一教会の回答に“再質問へ” 厚労相,旧統一教会で行われてきた信者どうしの養子縁組をめぐり、加藤厚生労働大臣は、教団から届いた質問書への回答を精査した結果、さらに確認する必要があるとして再び質問を行うともに、教団に対して法律の順守を求める文書を送ることを明らかにしました。
https://www.nhk.or.jp/rss/news/cat4.xml,旧統一教会被害者救済法案 参院特別委で審議 法案は10日成立へ,旧統一教会の被害者救済を図る新たな法案は9日から参議院の特別委員会で審議が行われています。河野消費者担当大臣は、悪質な寄付などに関する相談体制を強化するため相談員に対するオンラインでの研修などを実施する考えを示しました。
https://www.nhk.or.jp/rss/news/cat4.xml,防衛費増額の財源 ”企業への増税は慎重に” 西村経産相,防衛費の増額で不足する財源を賄うため、政府・与党の間で法人税を軸に増税の検討が進められる見通しとなっていることについて、西村経済産業大臣は、多くの企業が投資や賃上げに意欲を示すなかで、この5年間が日本経済再生に向けたラストチャンスだとして、企業への増税については慎重に対応すべきだという考えを示しました。
https://www.nhk.or.jp/rss/news/cat4.xml,岸田首相 広島で核軍縮を議論する「国際賢人会議」11日出席へ,岸田総理大臣は核軍縮に向けて国内外の有識者らが被爆地・広島で議論する「国際賢人会議」に11日、出席することになりました。「核兵器のない世界」の実現に向けた取り組みを前進させる機会にしたいとしています。
https://www.nhk.or.jp/rss/news/cat4.xml,衆院本会議欠席の谷国家公安委員長 検査で異常なく職務継続,8日に体調不良を訴えて衆議院本会議を欠席した谷国家公安委員長は、9日の閣議のあとの記者会見で「ご迷惑とご心配をおかけし申し訳ない」と陳謝したうえで、検査の結果異常はなかったとして、引き続き職務にあたる考えを示しました。
https://www.nhk.or.jp/rss/news/cat4.xml,国家公務員にきょう冬のボーナス支給 5年ぶりの増加,全国のほとんどの国家公務員に9日、冬のボーナスが支給され、管理職を除く平均支給額は去年よりおよそ500円多い65万2000円あまりで、5年ぶりの増加となりました。
https://www.nhk.or.jp/rss/news/cat4.xml,高松高等裁判所の新長官に岩井伸晃氏,高松高等裁判所の新しい長官に、東京高等裁判所の岩井伸晃部総括判事が起用されることになりました。
