url,title,summary
https://www.nhk.or.jp/rss/news/cat6.xml,【随時更新】ロシア ウクライナに軍事侵攻（17日の動き）,ロシアによるウクライナに対する軍事侵攻が続いています。ウクライナの各地でロシア軍とウクライナ軍が戦闘を続けていて、大勢の市民が国外へ避難しています。戦闘の状況や関係各国の外交など、ウクライナ情勢をめぐる17日（日本時間）の動きを随時更新でお伝えします。（日本とウクライナは7時間、ロシアのモスクワとは6時間の時差があります）
https://www.nhk.or.jp/rss/news/cat6.xml,中国政府 年末年始の帰省で農村部の感染拡大に警戒 新型コロナ,中国で新型コロナウイルスの感染対策が緩和されたあと初めての3連休となる、年末年始の鉄道の切符の販売が17日から始まりました。帰省する人が大幅に増えるとみられ、国内で感染者の急増が続く中、中国政府は、医療体制がぜい弱な農村部への感染拡大に警戒を強めています。
https://www.nhk.or.jp/rss/news/cat6.xml,台湾で東北地方や新潟県の魅力発信する催し“東北に足運んで”,日本への旅行に関心が高まる台湾で、東北地方や新潟県の魅力を発信する催しが開かれ、大勢の人でにぎわっています。
https://www.nhk.or.jp/rss/news/cat6.xml,巨大水槽破裂 熱帯魚など約1500匹流出 2人けが ベルリン中心部,ドイツの首都ベルリン中心部にある複合施設で16日、ロビーに設置された高さおよそ16メートルの巨大な円筒形の水槽が破裂して、熱帯魚などおよそ1500匹が、大量の水とともに流れ出し、2人がけがをしました。
https://www.nhk.or.jp/rss/news/cat6.xml,米国務省に「チャイナ・ハウス」発足 最大の競合国 中国に対抗,アメリカのバイデン政権は、最大の競合国と位置づける中国に対抗するため、16日、国務省内に、中国や安全保障、それに経済などの専門家を集めた部局横断的な専門部署「チャイナ・ハウス」を発足させました。
https://www.nhk.or.jp/rss/news/cat6.xml,経営破綻のFTXトレーディング 日本法人など事業売却承認を申請,先月、経営破綻した暗号資産の交換業大手、FTXトレーディングは、日本法人などの事業の売却に承認を求める申請書類をアメリカの裁判所に提出しました。裁判所が承認すれば入札が実施される運びで、日本法人の顧客への資産の返還が焦点となる中、売却手続きの行方が注目されます。
https://www.nhk.or.jp/rss/news/cat6.xml,米シカゴ 高校の近くで銃撃事件 4人撃たれ2人死亡 10代若者か,アメリカ中西部イリノイ州シカゴにある高校の近くで、16日午後、銃撃事件があり、地元の警察によりますと4人が撃たれ、2人が死亡しました。アメリカメディアは地元の消防の話として、撃たれた4人は、10代の若者だと伝えていますが高校の生徒かどうかなどは分かっていません。警察は、容疑者の行方を追うとともに事件の背景について調べています。
https://www.nhk.or.jp/rss/news/cat6.xml,ミサイル攻撃で各地停電 ゼレンスキー大統領「反撃する決意」,ウクライナへの軍事侵攻を続けるロシアは16日、ウクライナ各地のエネルギー関連施設を標的に再び大規模なミサイル攻撃を行い各地で停電が起きる事態となっています。ゼレンスキー大統領は、停電の復旧に全力を尽くす考えを示すとともに、「われわれには反撃する決意と自信がある」と徹底抗戦する構えを改めて強調しました。
https://www.nhk.or.jp/rss/news/cat6.xml,ロシア外務省 “中央アフリカのロシア文化施設で爆発”と発表,ロシア外務省は、中央アフリカにあるロシアの文化施設に届けられた小包が爆発し、施設の責任者がけがをしたと発表しました。現地で活動していると指摘されるロシアの民間軍事会社「ワグネル」の代表が旧宗主国フランスの関与を一方的に主張するなど、波紋が広がっています。
https://www.nhk.or.jp/rss/news/cat6.xml,生物兵器禁止条約の再検討会議 条約強化目指す最終文書を採択,細菌やウイルスを利用した生物兵器の開発などを禁止する生物兵器禁止条約の再検討会議は、ウクライナ情勢をめぐる欧米とロシアとの対立から合意が危ぶまれてきましたが、最終日になって各国が歩み寄り、条約の強化を目指す最終文書が採択されて、閉幕しました。
https://www.nhk.or.jp/rss/news/cat6.xml,中国 新型コロナ感染対策適正化と高齢者対策に重点の方針強調,中国で来年の経済運営の方針を決める重要会議が開かれ、新型コロナウイルスの感染対策を適正化していくとともに、高齢者などの対策に重点を置くという方針を強調しました。「ゼロコロナ」政策の転換に踏み切ったことで混乱も生じている中、いち早く景気回復につなげることができるのかが焦点です。
https://www.nhk.or.jp/rss/news/cat6.xml,英科学雑誌 「ことしの10人」に国連のグテーレス事務総長ら,世界的に知られるイギリスの科学雑誌「ネイチャー」は、科学の分野で重要な役割を果たした「ことしの10人」に、国連のグテーレス事務総長やウクライナの気候学者などを選びました。
https://www.nhk.or.jp/rss/news/cat6.xml,米バイデン政権 日本の安全保障関連3文書の閣議決定を歓迎,日本政府が防衛力の抜本的な強化に向け、安全保障関連の3つの文書を閣議決定したことについて、アメリカのバイデン政権は歓迎する意向を表明し、軍事力を増強する中国などを念頭に、日米の連携を強化しながら抑止力を高めたい考えです。
https://www.nhk.or.jp/rss/news/cat6.xml,カナダで開催COP15会場で生物多様性の保護 日本の取り組み発信,カナダで開催されている生物多様性の保護を話し合う国連の会議「COP15」の会場で、2010年に名古屋市で開かれた「COP10」からの日本の取り組みを報告するセミナーなどが開かれました。
https://www.nhk.or.jp/rss/news/cat6.xml,ウクライナ 発電施設が被害 “電力需要の50％が供給できない”,ウクライナへの軍事侵攻を続けるロシアは16日、ウクライナ各地のエネルギー関連施設を標的に再び大規模なミサイル攻撃を行い、ウクライナのエネルギー相は、電力需要の50％が供給できない状況に陥ったと明らかにしました。
https://www.nhk.or.jp/rss/news/cat6.xml,NYダウ 一時500ドル超の大幅な下落 世界経済の減速懸念強まる,16日のニューヨーク株式市場は、来年も欧米で利上げが続き世界経済が減速することへの懸念から売り注文が増え、ダウ平均株価は一時、500ドルを超える大幅な値下がりとなりました。
https://www.nhk.or.jp/rss/news/cat6.xml,ソウル繁華街 群集事故から四十九日 遺族ら現場近くで追悼集会,韓国 ソウルの繁華街イテウォン（梨泰院）で、158人が死亡した群集事故から四十九日となった16日夜、遺族たちが追悼集会を開き、亡くなった家族を悼みました。
https://www.nhk.or.jp/rss/news/cat6.xml,中国 感染拡大の北京 体育館に臨時の発熱外来 人手不足も深刻,中国で新型コロナウイルスの感染が拡大する中、首都・北京では医療体制がひっ迫し、体育館などに臨時の発熱外来を設けて患者の診察にあたっています。感染の拡大に伴う人手不足も深刻な状況で、宅配便の配達が遅れるなど市民生活に大きな影響が出ています。
https://www.nhk.or.jp/rss/news/cat6.xml,中国海軍の空母など6隻 沖縄本島と宮古島間を通過し太平洋に,中国海軍の空母など6隻が16日午後、沖縄本島と宮古島の間を通過し、東シナ海から太平洋に出たのが確認されました。中国の空母がこの海域を通過したのはことし5月以来で、防衛省は航行の目的を分析するとともに警戒と監視を続けています。
https://www.nhk.or.jp/rss/news/cat6.xml,台湾 与党・民進党 頼清徳副総統を新しいトップに選出へ,台湾の与党・民進党の新しいトップに、次の総統の有力候補とみられている頼清徳副総統が選ばれる見通しになりました。
https://www.nhk.or.jp/rss/news/cat6.xml,北朝鮮 大出力固体燃料「米本土攻撃できるICBM用」韓国専門家,北朝鮮が大出力の固体燃料エンジンの燃焼実験に成功したと発表したことについて、韓国の専門家は、アメリカ本土を攻撃できるICBM＝大陸間弾道ミサイル級の、弾道ミサイル用としては初めての固体燃料エンジンの開発の一環だという見方を示しました。
https://www.nhk.or.jp/rss/news/cat6.xml,ロシア 来年の早い時期に大規模攻撃か 大統領ベラルーシ訪問へ,ウクライナ軍は、ロシア軍が来年の早い時期に大規模な攻撃を仕掛ける可能性があるとして警戒を強めています。こうした中、ロシアのプーチン大統領は来週、同盟関係にあるベラルーシを訪問する予定で、軍事的な圧力を強め揺さぶりをかける思惑とみられます。
https://www.nhk.or.jp/rss/news/cat6.xml,【詳細】ロシア ウクライナに軍事侵攻（16日の動き）,ロシアによるウクライナに対する軍事侵攻が続いています。ウクライナの各地でロシア軍とウクライナ軍が戦闘を続けていて、大勢の市民が国外へ避難しています。戦闘の状況や関係各国の外交など、ウクライナ情勢をめぐる16日（日本時間）の動きを随時更新でお伝えします。（日本とウクライナは7時間、ロシアのモスクワとは6時間の時差があります）
https://www.nhk.or.jp/rss/news/cat6.xml,マレーシア キャンプ場で土砂崩れ 16人死亡 17人行方不明,マレーシアの首都クアラルンプール近郊のキャンプ場で16日未明、大規模な土砂崩れがあり、地元当局によりますとこれまでに16人が死亡し、17人の行方が分からなくなっていて捜索活動が続いています。
https://www.nhk.or.jp/rss/news/cat6.xml,EU 男女別賃金 当局への提出や従業員への開示義務づけ法案合意,EU＝ヨーロッパ連合の議会と加盟国は、域内の企業に対し、男女別の賃金の当局への提出や従業員への開示を義務づける法案に合意し、男女の賃金格差の解消と同一賃金のさらなる推進を図ることになりました。
https://www.nhk.or.jp/rss/news/cat6.xml,コロナ対策緩和の中国で感染拡大 日本人多い上海で警戒広がる,新型コロナウイルスの感染対策の緩和に踏み切った中国では、北京などで感染が急拡大していて、最も多くの日本人が暮らす上海でも、日系企業が在宅勤務に切り替えるなど、感染拡大への警戒が広がっています。
https://www.nhk.or.jp/rss/news/cat6.xml,ツイッター マスク氏担当の大手メディア記者のアカウント停止,ソーシャルメディア大手、ツイッターは、15日、同社を買収したイーロン・マスク氏の取材を担当しているニューヨーク・タイムズなど、複数の記者たちのアカウントの利用を停止する措置をとりました。
https://www.nhk.or.jp/rss/news/cat6.xml,【解説】ロシア 来年早い時期に大規模攻撃か ウクライナは警戒,ウクライナへ侵攻するロシアの大統領府は、クリスマスや新年の時期に停戦する可能性を否定し、ロシア軍は軍事作戦を続ける構えです。一方のウクライナ側も、ロシア軍が来年の早い時期に大規模な攻撃を仕掛ける可能性があるとして警戒を強めています。兵力不足や武器不足まで指摘されるロシア軍について、ウクライナのクレバ外相は「ロシア軍はおそらく大規模な攻撃を行う能力を（来年の）1月末か2月までに取り戻すだろう。ロシア軍はそれを目指している」と語りました。そして前線に砲弾が足りないと強調し、欧米各国に砲弾の提供も求めました。さらにウクライナ軍は、ロシア軍の戦意を喪失させ、前線のロシア兵に投降を呼びかける作戦に取り組んでいます。油井秀樹キャスターの解説です。（動画は2分54秒。データ放送ではご覧になれません）
https://www.nhk.or.jp/rss/news/cat6.xml,ソウル繁華街事故 生存者の高校生が自殺 友人2人を亡くす,韓国ソウルのイテウォン（梨泰院）での群集事故の際に現場にいて、一緒にいた友人を亡くした男子高校生が今週、自殺しました。高校生の母親は亡くなった友人を侮辱するようなネット上のコメントを見たのが原因だと話していて、16日が四十九日となる中、生き残った人の心の傷は癒えないままです。
https://www.nhk.or.jp/rss/news/cat6.xml,米上院 “台湾へ軍事支援 今後5年間で最大100億ドル”法案可決,アメリカ議会上院は、中国が軍事的な圧力を強める台湾に対して、今後5年間で最大100億ドルの軍事支援を行うことなどを盛り込んだ、国防予算の大枠を定める法案を可決しました。
https://www.nhk.or.jp/rss/news/cat6.xml,北朝鮮 “大出力の固体燃料エンジン 燃焼実験成功” 労働新聞,北朝鮮は、キム・ジョンウン（金正恩）総書記の立ち会いのもと、大出力の固体燃料エンジンの燃焼実験に初めて成功したと発表しました。「国防5か年計画」で挙げている固体燃料を用いたICBM＝大陸間弾道ミサイルの開発と関連している可能性があります。
https://www.nhk.or.jp/rss/news/cat6.xml,国連総会 北朝鮮に全拉致被害者の即時帰還求める決議 採択,北朝鮮の人権侵害を非難し、すべての拉致被害者の即時帰還を北朝鮮に求める決議案が国連総会に提出され、18年連続で採択されました。
https://www.nhk.or.jp/rss/news/cat6.xml,前大統領拘束のペルーでデモ続き 空港封鎖 日本人観光客足止め,前の大統領が拘束されたことに反発するデモが続く南米のペルーでは、現在も国内の5つの空港や各地の幹線道路がデモ隊によって封鎖されていて、およそ20人の日本人観光客が現地で足止めされています。
https://www.nhk.or.jp/rss/news/cat6.xml,EU首脳会議 ウクライナへ 約2兆6000億円支援で合意,EU＝ヨーロッパ連合は首脳会議を開き、ウクライナに対して、来年、総額180億ユーロおよそ2兆6000億円を支援することで合意しました。
https://www.nhk.or.jp/rss/news/cat6.xml,プーチン大統領 一方的併合の4州 経済など発展計画策定を指示,ロシアのプーチン大統領は、一方的な併合に踏み切ったウクライナの4つの州について、経済などを発展させるとする計画を策定するよう政府に指示しました。ロシアはウクライナ軍が反撃を強める中でも、併合したとする地域の支配の既成事実化を推し進めようとしています。
https://www.nhk.or.jp/rss/news/cat6.xml,米バイデン政権 中国の36企業など 禁輸リスト追加 中国に圧力,アメリカのバイデン政権は中国の半導体メーカーなど36の企業や団体を新たに事実上の禁輸リストに追加すると発表しました。ことし10月にも半導体関連製品について中国向けの輸出規制を強化すると発表していて、ハイテク分野をめぐって覇権争いを続ける中国への圧力を強めています。
https://www.nhk.or.jp/rss/news/cat6.xml,NYダウ 一時900ドル超える急落 為替は138円台前半まで円安進む,15日のニューヨークの金融市場では、アメリカの小売業の売上高の発表を受けて景気減速が懸念されたことや来年も利上げが続くとの見方から一時、ダウ平均株価が900ドルを超える急落となったほか、1ドル＝138円台前半まで円安が進みました。
https://www.nhk.or.jp/rss/news/cat6.xml,英 看護師などの労働組合 創設以来初めて全国規模のストライキ,記録的なインフレが続くイギリスで賃上げを求めて幅広い業種でストライキが相次ぐなか、15日には看護師などの労働組合がおよそ100年前に創設されて以来初めてとなる全国規模のストライキを行いました。
https://www.nhk.or.jp/rss/news/cat6.xml,米 バイデン大統領 アフリカ各国にロシア非難の同調 呼びかけ,アメリカのバイデン大統領は、アフリカ各国の首脳を招いた会議で、ウクライナ侵攻を続けるロシアについて世界経済を混乱させたと批判し、ロシアに配慮するアフリカの国々もある中でロシアへの非難に同調するよう呼びかけました。
https://www.nhk.or.jp/rss/news/cat6.xml,“仕事を探している” 働いていないウクライナ避難民の6割近く,ウクライナから日本に避難してきた人を支援している日本財団が、避難者にアンケートを行ったところ、働いていない人の6割近くが仕事を求めていることがわかりました。
https://www.nhk.or.jp/rss/news/cat6.xml,韓国大統領 IAEA事務局長と会談 北朝鮮の非核化へ監視強化を,韓国を訪れているIAEA＝国際原子力機関のグロッシ事務局長とユン・ソンニョル（尹錫悦）大統領が15日、会談しました。
https://www.nhk.or.jp/rss/news/cat6.xml,ロシア軍 来年早い時期に大規模攻撃か ウクライナ警戒強める,ウクライナへ侵攻するロシアの大統領府はクリスマスや新年の時期に停戦する可能性を否定し、ロシア軍は軍事作戦を続ける構えです。一方のウクライナ側も、ロシア軍が来年の早い時期に大規模な攻撃を仕掛ける可能性があるとして警戒を強めています。
https://www.nhk.or.jp/rss/news/cat6.xml,中国 新型コロナ脅威訴えてきた専門家 見解一転し批判も,中国で新型コロナウイルスの脅威を訴えてきた専門家が、感染の主流となっているオミクロン株について、一転して「怖いものではなく『新型コロナかぜ』と呼ぶべきものだ」と強調しました。政府が感染対策の緩和に踏み切ったことにあわせて、専門家が見解まで変えたとして批判の声も上がっています。
https://www.nhk.or.jp/rss/news/cat6.xml,米 先月の小売業売上高 0.6％減 インフレと利上げ 消費に影響,アメリカの先月の小売業の売上高は前の月と比べて0.6％減少し、記録的なインフレと利上げが個人消費に影響を与えていることを示す形になりました。
https://www.nhk.or.jp/rss/news/cat6.xml,ヨーロッパ中央銀行 0.5％利上げ決定 景気配慮で上げ幅縮小か,ヨーロッパ中央銀行は15日、金融政策を決める理事会を開き、0.5％の利上げを決めました。これまで2回連続で0.75％の大幅利上げに踏み切りましたが今回は利上げ幅を縮小しました。景気にも配慮したとみられます。
https://www.nhk.or.jp/rss/news/cat6.xml,台湾 選挙法改正へ 偽動画 “ディープフェイク”の拡散に罰則,台湾で中国などによる世論工作への警戒が強まるなか、内閣にあたる行政院はAI＝人工知能を用いて作った本物と見分けがつかない偽の動画「ディープフェイク」によって選挙に影響を与えようとする行為に、新たに罰則を設けるなどとした法律の改正案をまとめ、再来年の総統選挙までの成立をめざしています。
https://www.nhk.or.jp/rss/news/cat6.xml,林外相 ジョージア外相会談 “ウクライナ侵攻に連携対応を”,林外務大臣はジョージアのダルチアシビリ外相と会談し、法の支配に基づく国際秩序を維持、強化していくため、ロシアによるウクライナへの軍事侵攻に対し緊密に連携して対応していきたいという考えを伝えました。
https://www.nhk.or.jp/rss/news/cat6.xml,英 イングランド銀行 0.5％の大幅利上げ発表 利上げは9回連続,イギリスの中央銀行、イングランド銀行は15日、政策金利を0.5％引き上げると発表しました。金融引き締めによる景気後退への懸念を背景に前回の利上げから上げ幅を縮小する一方、記録的なインフレを抑え込む姿勢を引き続き示した形です。
https://www.nhk.or.jp/rss/news/cat6.xml,ドーバー海峡で移民乗ったゴム製ボートが沈む 4人の死亡を確認,イギリスとフランスの間のドーバー海峡で多くの移民が乗ったゴム製のボートが沈み、これまでに4人の死亡が確認されました。海峡を渡ってイギリスへの密入国を図る移民はことし大幅に増えていて、スナク政権は対策としてこうした人たちをアフリカに移送する計画などについて、非難もある中、実行に移す構えです。
https://www.nhk.or.jp/rss/news/cat6.xml,ロシアプーチン大統領 “欧米側の経済制裁は失敗 市民は結束”,ロシアのプーチン大統領はモスクワ郊外の公邸で行ったオンライン会議で「前例のない制裁による攻撃が行われ、それはわれわれの経済の破壊を目的としている。しかし、欧米側のもくろみは失敗し、ロシア市民は結束を示した。通貨ルーブルはことし世界で最も強力な通貨の1つとなった」と述べ、欧米側の経済制裁はロシアに打撃を与えていないと強調しました。
https://www.nhk.or.jp/rss/news/cat6.xml,【詳細】ロシア ウクライナに軍事侵攻（15日の動き）,ロシアによるウクライナに対する軍事侵攻が続いています。ウクライナの各地でロシア軍とウクライナ軍が戦闘を続けていて、大勢の市民が国外へ避難しています。戦闘の状況や関係各国の外交など、ウクライナ情勢をめぐる15日（日本時間）の動きを随時更新でお伝えします。（日本とウクライナは7時間、ロシアのモスクワとは6時間の時差があります）
https://www.nhk.or.jp/rss/news/cat6.xml,影響力あるインフルエンサー参加 青森県が台湾でりんごなどPR,青森県産のりんごなどの人気が高い台湾を、青森県知事が訪れ、県の魅力をアピールしました。
https://www.nhk.or.jp/rss/news/cat6.xml,アメリカの「パトリオット」ウクライナに供与へ ロシア側反発,ロシア軍からのミサイル攻撃に対するウクライナの防空能力を強化するためアメリカが迎撃ミサイル「パトリオット」を供与する方向で最終調整していると伝えられています。これに対し、ロシア側は「新たな挑発行為だ」として反発しています。
https://www.nhk.or.jp/rss/news/cat6.xml,中国 北京などの日系企業で新型コロナ感染拡大相次ぐ,中国では、政府が新型コロナウイルスの感染対策の緩和に踏み切ったあと、各地で感染が拡大しているとみられます。北京では、従業員の多くが感染したという日系企業が相次いでいて、今後、経済などへの影響をどこまで抑えられるかが焦点です。
https://www.nhk.or.jp/rss/news/cat6.xml,ペルー抗議デモ全土に拡大 7人死亡 非常事態宣言 観光客足止め,南米のペルーでは、カスティジョ前大統領が拘束されたことに反発する抗議デモが全土に広がり、治安部隊との衝突でこれまでに7人が死亡し、ペルー政府は非常事態を宣言しました。抗議デモの影響でペルー国内では観光客が各地で足止めされていて、ペルーの日本大使館は日本人の観光客に対し安全な場所で事態の沈静化を待つよう促しています。
https://www.nhk.or.jp/rss/news/cat6.xml,株価 値下がり 米で来年も利上げ継続への警戒感から売り注文,15日の東京株式市場、アメリカで来年も利上げが続くことへの警戒感から売り注文が出て、日経平均株価は値下がりしました。
