url,title,summary
https://www.nhk.or.jp/rss/news/cat1.xml,コロナ 感染症法上の位置づけ「状況見極め 見直し判断」厚労相,新型コロナの感染症法上の位置づけについて、加藤厚生労働大臣は、今後の感染状況などを見極めながら見直しを判断する考えを重ねて示しました。
https://www.nhk.or.jp/rss/news/cat1.xml,東京高検に広島高検の畝本検事長起用 5か所の高検に新検事長,5つの高等検察庁の検事長の人事が決まり、東京高等検察庁の新しい検事長に広島高等検察庁の畝本※直美検事長が、大阪高等検察庁の新しい検事長に札幌高等検察庁の小山太士検事長が起用されることになりました。
https://www.nhk.or.jp/rss/news/cat1.xml,小中学生の学校や塾など年間の学習費 過去最高に 文科省調査,学校や塾など、保護者が子ども1人の学習にかける年間の費用は、公立の小学校で35万円余り、中学校で53万円余りとなり、ともに過去最高となったことが、文部科学省の調査でわかりました。
https://www.nhk.or.jp/rss/news/cat1.xml,島根 竹島周辺海域 韓国軍 22日に定例訓練行ったと明らかに,韓国政府の関係者は、「トクト（独島）」と呼んで領有権を主張する島根県の竹島の周辺海域で、韓国軍が22日に定例の訓練を行ったことを明らかにしました。この訓練について、日本政府は、これまで繰り返し抗議し中止するよう求めています。
https://www.nhk.or.jp/rss/news/cat1.xml,コロナとインフル同時流行懸念 年末年始の医療体制強化 東京,新型コロナウイルスとインフルエンザの同時流行が懸念される中、東京 世田谷区で、年末年始も含めて区内の15歳以下の子どもの診療を行う臨時の診療所が開設されるなど、年末年始の医療体制を強化する動きが出ています。
https://www.nhk.or.jp/rss/news/cat1.xml,【気象予報士解説】記録的大雪 猛吹雪のおそれ 今後の見通しは,強い冬型の気圧配置の影響で、北陸や北海道を中心に北日本から西日本の日本海側などで雪が強まっているほか、高知市では積雪が観測史上最も多くなるなど四国の太平洋側でも記録的な大雪となっています。雪は、今月26日にかけて続き積雪がさらに増える見込みで、車の立往生や事故など交通への影響に警戒するとともに、路面の凍結による歩行中の転倒などにも十分注意してください。今後の雪の見通しについて、佐藤公俊気象予報士の解説です。【動画:2分42秒】（データ放送ではご覧になれません）
https://www.nhk.or.jp/rss/news/cat1.xml,【動画】北海道 幕別町 電柱など倒れ道路を塞ぐ,大雪となっている北海道幕別町の国道では、電柱などが倒れて道路をふさいでいて、警察官が通行する車を周辺の道路にう回させるなど対応にあたっています。
https://www.nhk.or.jp/rss/news/cat1.xml,神奈川 茅ヶ崎 男性刺殺事件 容疑者 不動産関連会社と関わりか,神奈川県茅ヶ崎市の住宅で55歳の男性が殺害された事件で、22日に逮捕された50歳の容疑者は、男性が営む不動産関連の会社と関わりがあったことが、捜査関係者への取材でわかりました。警察は2人の間にトラブルがなかったか詳しく調べています。
https://www.nhk.or.jp/rss/news/cat1.xml,覚醒剤1.9キロ1億円余相当 成田空港に密輸した疑い 会社員逮捕,覚醒剤およそ1.9キロ、末端の密売価格で1億円余りを航空便でアメリカから成田空港に密輸したとして、47歳の会社員が逮捕されました。
https://www.nhk.or.jp/rss/news/cat1.xml,尖閣沖 中国海警局の船2隻 新たに領海侵入 別の2隻は領海外に,23日朝、沖縄県の尖閣諸島の沖合で、中国海警局の船2隻が新たに領海侵入し、22日から領海侵入を続けていた別の2隻は領海の外に出ました。領海侵入した2隻は、付近で操業している日本の漁船に近づこうとしていて、海上保安本部が巡視船を配置して漁船の安全を確保するとともに、直ちに領海から出るよう警告を続けています。
https://www.nhk.or.jp/rss/news/cat1.xml,FTXトレーディング前CEO 保証金 約330億円で保釈 詐欺などの罪,暗号資産の交換業大手、FTXトレーディングが経営破綻した問題で、詐欺などの罪に問われている創業者バンクマンフリード前CEOが、ニューヨークの裁判所に出廷し、日本円でおよそ330億円を支払い、保釈されました。
https://www.nhk.or.jp/rss/news/cat1.xml,大雪影響 各地で停電相次ぐ 北海道では6180戸停電,北海道電力によりますと、午前11時10現在、道内では、十勝地方やオホーツク地方を中心にあわせておよそ6180戸が停電しているということです。100戸以上が停電しているのは▼十勝地方では、▽帯広市でおよそ910戸、▽大樹町でおよそ540戸、▽清水町でおよそ150戸、▽幕別町でおよそ140戸、▽広尾町でおよそ130戸、▽豊頃町でおよそ110戸です。▼日高地方では、▽えりも町でおよそ1150戸、▼釧路地方では、▽白糠町でおよそ190戸、▽釧路市でおよそ130戸が停電しています。▼オホーツク地方では、▽紋別市で1090戸、▽興部町でおよそ220戸、▽雄武町でおよそ140戸、▽清里町でおよそ140戸、▽佐呂間町でおよそ100戸、▼根室地方では、▽別海町でおよそ130戸、▽中標津町でおよそ110戸、▼宗谷地方では▽枝幸町でおよそ130戸が停電しています。北海道電力は原因を調べるとともに、復旧作業を進めています。
https://www.nhk.or.jp/rss/news/cat1.xml,東京湾アクアライン 通行止め 強風の影響で,日本道路交通情報センターによりますと、千葉県木更津市と神奈川県川崎市を結ぶ東京湾アクアラインは強風の影響で下り線が川崎浮島ジャンクションから木更津金田インターチェンジの間で、上り線がアクアライン連絡道を含む袖ヶ浦インターチェンジから川崎浮島ジャンクションの間で午前8時から通行止めになっています。
https://www.nhk.or.jp/rss/news/cat1.xml,金沢地方気象台「顕著な大雪に関する情報」発表,金沢地方気象台は午前8時16分に「顕著な大雪に関する石川県気象情報」を発表しました。気象台によりますと金沢市では、23日午前8時までの6時間に20センチの顕著な降雪を観測しました。この強い雪は23日夜遅くにかけて続く見込みで、気象台は加賀地方の平野部では大規模な交通障害が発生するおそれが高まっているとして、大雪に厳重に警戒するように呼びかけています。
https://www.nhk.or.jp/rss/news/cat1.xml,【JAF解説】立往生の危険 やむをえず車に乗る場合の備えは?,大雪の際に車を運転すると、立往生などの危険があります。やむをえず外出しなければならない場合の注意点について、JAF＝日本自動車連盟で交通安全インストラクターを務める由水雅也さんに聞きました。【動画：2分48秒】（データ放送ではご覧になれません）
https://www.nhk.or.jp/rss/news/cat1.xml,【気象予報士解説】日本海側中心に大雪 警戒すべき点は,これから各地で雪が強まり、北日本から西日本の日本海側を中心に26日の月曜日ごろにかけて大雪となるほか、太平洋側でも大雪となるところがある見込みです。今後の見通しと警戒すべき点について檜山靖洋気象予報士の解説です。【動画：1分50秒】（データ放送ではご覧になれません）
https://www.nhk.or.jp/rss/news/cat1.xml,東京湾フェリー 始発便から欠航 海上の気象状況悪化のため,神奈川県横須賀市の久里浜と千葉県富津市の金谷を結ぶ「東京湾フェリー」は、海上の気象状況が悪化しているとして、22日の最終便に続き23日も始発便から欠航すると発表しました。午前6時20分現在、運航再開の見通しは立っていないとしています。
https://www.nhk.or.jp/rss/news/cat1.xml,内房線 佐貫町～館山間 昼ごろまで上下線で運転見合わせ,JR東日本によりますと、内房線は強風のため23日の始発から昼ごろまで佐貫町駅と館山駅の間の上下線で運転を見合わせています。
https://www.nhk.or.jp/rss/news/cat4.xml,過去最大114兆円の予算案 防衛費など増額で安定財源確保が課題,政府は23日に一般会計の総額が114兆円を超えて過去最大となる来年度の当初予算案を閣議決定しました。新規の国債の発行額が歳入の3割以上を占めるなど国債頼みの状況が続き、防衛費などの増額が見込まれる中、安定的な財源確保が課題となります。
https://www.nhk.or.jp/rss/news/cat4.xml,北朝鮮ミサイル発射 外務省幹部と米高官 日米韓で緊密連携確認,北朝鮮による弾道ミサイルの発射を受けて、外務省幹部がアメリカの高官と電話で対応を協議し、発射は国際社会への明白な挑戦だという認識を共有し、日米両国や日米韓3か国で緊密に連携することを確認しました。
https://www.nhk.or.jp/rss/news/cat4.xml,岸田首相「来年は結果を出す1年に」派閥会合で意気込み語る,岸田総理大臣は23日夜、東京都内で開かれたみずからが会長を務める自民党岸田派の会合に出席し、ことしは政策の大きな土台をつくることができたと振り返ったうえで、来年は結果を出す1年にしたいと意気込みを語りました。
https://www.nhk.or.jp/rss/news/cat4.xml,和歌山1区補選 自民 鶴保庸介参院議員を擁立する方向で調整,早ければ来年4月に行われる衆議院和歌山1区の補欠選挙について、自民党は、鶴保庸介参議院議員を擁立する方向で調整に入りました。
https://www.nhk.or.jp/rss/news/cat4.xml,小池都知事「コロナとインフル 年末年始に向け対策の徹底を」,東京都で新型コロナの感染が拡大する中、インフルエンザの流行期に入ったことを受け、小池知事は「ウイルスは異なるが対処法は同じだ」と述べ、年末年始に向けて、ワクチンの接種や換気の実施など感染対策の徹底を改めて呼びかけました。
https://www.nhk.or.jp/rss/news/cat4.xml,秋葉復興相 政府・与党内で “交代論” 今後 具体的な調整へ,政治資金をめぐる問題などが明らかになっている秋葉復興大臣について、政府・与党内では、来年1月の通常国会の召集前に交代させるべきだという声が強まっていて、今後、具体的な調整が進められる見通しです。
https://www.nhk.or.jp/rss/news/cat4.xml,全国知事会 年末年始 コロナで医療ひっ迫懸念 国に緊急提言へ,新型コロナの感染者数が増加傾向となる中、全国知事会は対策本部の会合を開き、年末年始に医療ひっ迫が懸念されることからワクチン接種の促進や、自宅療養者への支援体制の強化などを国に求める緊急提言をまとめました。
https://www.nhk.or.jp/rss/news/cat4.xml,先月就任した松本総務相の資産公開,先月就任した松本総務大臣の資産が、23日、公開されました。
https://www.nhk.or.jp/rss/news/cat4.xml,年末年始にコロナ無料検査拠点 全国の主要駅など126か所設置へ,年末年始の帰省などで、人と人の接触機会が増えることが予想されるとして、政府は、全国の主要な駅や空港など120か所余りに、24日から新型コロナの無料検査拠点を臨時に設置すると発表しました。
https://www.nhk.or.jp/rss/news/cat4.xml,税制改正大綱を閣議決定 防衛力の必要財源に増税実施盛り込む,政府は、自民・公明両党が今月16日にまとめた来年度の税制改正大綱を23日、閣議決定しました。
https://www.nhk.or.jp/rss/news/cat4.xml,新型コロナ 中国に滞在の日本人1人が死亡 官房長官明らかに,松野官房長官は記者会見で、新型コロナウイルスの感染が急拡大している中国で、現地の日本人1人が検査で陽性となったあとに死亡したことを明らかにし、日本人の保護と日本企業の活動支援に万全を期していく考えを示しました。
https://www.nhk.or.jp/rss/news/cat4.xml,従来の保険証 3割負担の患者の場合 窓口負担6円上乗せ,マイナンバーカードと一体化した健康保険証を利用できる医療機関で、従来の保険証を利用すると3割負担の患者の場合、来年4月から12月末までの間、窓口負担に、今よりも6円上乗せされることになりました。
https://www.nhk.or.jp/rss/news/cat4.xml,来年度の国家公務員の定員 全体で約860人増へ,来年度の国家公務員の定員について、政府は、こども家庭庁や内閣感染症危機管理統括庁を新設することなどで今年度に比べ、全体でおよそ860人増やすことを決めました。
https://www.nhk.or.jp/rss/news/cat4.xml,官房長官 神奈川県知事らと面会 “拉致被害者帰国実現に全力”,北朝鮮による拉致問題をめぐり、松野官房長官は、被害者の早期救出を目指す神奈川県や新潟県の知事と面会し、家族が高齢化する中一刻の猶予もないとして、帰国の実現に全力を尽くす考えを強調しました。
https://www.nhk.or.jp/rss/news/cat4.xml,自民 衆院「10増10減」対象の72選挙区で公認候補の支部長決定,衆議院の小選挙区の「10増10減」をめぐり、自民党は、対象となる15の都県の選挙区のうち、およそ半数に当たる72選挙区で次の衆議院選挙の公認候補となる支部長を決定しました。
https://www.nhk.or.jp/rss/news/cat4.xml,コロナとインフル同時流行懸念 厚労相“年末年始へ準備を”,厚生労働省は、年末年始に向けて新型コロナとインフルエンザの同時流行に備えるための対策会議を開きました。
https://www.nhk.or.jp/rss/news/cat4.xml,N党ガーシー参院議員 “海外でSNS利用し不正暴露”欠席の回答,国会を欠席している理由を答えるよう求められていたNHK党のガーシー参議院議員は「海外でSNSを利用して不正を暴露し裁くことで、この国の不満を解消していく」などとする書面を提出しました。
https://www.nhk.or.jp/rss/news/cat4.xml,自民 二階元幹事長 「来月通常国会前の内閣改造 “1つの手”」,自民党の二階元幹事長は、TBSのCS番組「国会トークフロントライン」の収録で、内閣支持率の低迷が続く岸田政権の局面打開策として、来月召集される通常国会の前に、内閣改造を行うことも選択肢の1つになるという認識を示しました。
https://www.nhk.or.jp/rss/news/cat4.xml,中国船侵入など深刻な脅威に 海保と海自連携強化を 有識者会議,新しい「海洋基本計画」の策定に向けて議論してきた有識者会議は、中国海警局の船による領海侵入など、日本の海洋は深刻な脅威に直面しているとして、海上保安庁と海上自衛隊の連携強化などを求める意見書をまとめ、岸田総理大臣に提出しました。
https://www.nhk.or.jp/rss/news/cat4.xml,林外相 中南米と米訪問 国連で討論主催 国際秩序強化訴えへ,林外務大臣は記者会見で、来年1月に中南米4か国とアメリカを訪問すると発表しました。アメリカでは法の支配をテーマに公開討論を主催し、国際秩序を強化する重要性を訴えたい考えです。
https://www.nhk.or.jp/rss/news/cat4.xml,コロナ 感染症法上の位置づけ「状況見極め 見直し判断」厚労相,新型コロナの感染症法上の位置づけについて、加藤厚生労働大臣は、今後の感染状況などを見極めながら見直しを判断する考えを重ねて示しました。
https://www.nhk.or.jp/rss/news/cat4.xml,“核のゴミ”最終処分 官房長官 経産相中心に対応策まとめ指示,高レベル放射性廃棄物、いわゆる「核のゴミ」の最終処分をめぐって、松野官房長官は、解決に向けた対策を進めることが必要だとして、西村経済産業大臣を中心に対応策を取りまとめるよう指示しました。
https://www.nhk.or.jp/rss/news/cat4.xml,岸田首相「来年度予算案は未来切り開くもの 早期成立を」,一般会計の総額が過去最大の来年度・令和5年度予算案について、岸田総理大臣は直面する難局を乗り越え未来を切り開くための予算だとして、来年の通常国会で速やかに成立させたいという考えを示しました。
https://www.nhk.or.jp/rss/news/cat4.xml,宇宙の安全保障構想 来夏めど策定 基本計画も見直し方針 首相,新しい「国家安全保障戦略」に沿って、宇宙の安全保障分野での対応能力などを強化するため、岸田総理大臣は、来年夏をめどに宇宙の安全保障構想を策定したうえで、3年ぶりに宇宙基本計画を見直す方針を明らかにし、関係閣僚に具体化を進めるよう指示しました。
https://www.nhk.or.jp/rss/news/cat4.xml,首相 “法人税増税に理解を 防衛力強化は経済活動にも直結”,防衛費増額に向けた法人税の増税について、岸田総理大臣は、経済界の関係者らを前に、防衛力の強化は海上交通路の安全確保など経済活動にも直結するとして、理解を求めました。
https://www.nhk.or.jp/rss/news/cat5.xml,日野自動車 本社工場の敷地の一部売却へ 財務状況改善ねらいか,大手トラックメーカーの日野自動車は3年後をめどに生産の移管を完了する予定の本社工場について、敷地の一部を売却する方針を固めました。
https://www.nhk.or.jp/rss/news/cat5.xml,中小企業経営者の個人保証 創業5年以内は不要 事業拡大後押し,中小企業が金融機関から融資を受ける際に、経営者個人が連帯保証人となる「個人保証」について、政府は創業5年以内のスタートアップ企業には個人保証を求めない制度をつくり、創業や事業の拡大を後押しすることになりました。
https://www.nhk.or.jp/rss/news/cat5.xml,過去最大の114兆円余の来年度予算案 閣議決定 国債は35兆円超,政府は、23日の臨時閣議で、一般会計の総額が過去最大の114兆3812億円となる来年度・令和5年度予算案を決定しました。この財源を賄うために新たに発行する国債は35兆円を超えていて、財源の3割以上を国債に頼る厳しい財政状況が続いています。
https://www.nhk.or.jp/rss/news/cat5.xml,輸入米の品質検査で不正 日本穀物検定協会に業務停止命令へ,穀物の検査などを手がける「日本穀物検定協会」が、輸入米の品質検査で不正な検査を行っていたことが分かりました。農林水産省は「日本穀物検定協会」に対して、外国産農産物の検査について3か月間の業務停止命令などを出すことにしています。
https://www.nhk.or.jp/rss/news/cat5.xml,NTTドコモ 今月17日の通信障害 約240万人に影響,NTTドコモは、今月17日に西日本で起きたインターネットの通信障害でおよそ240万人が影響を受けたと発表しました。総務省は法律で定める重大な事故に当たるとして、詳細な報告を求めることにしています。
https://www.nhk.or.jp/rss/news/cat5.xml,円相場 値下がり 米利上げ長期化の見方で金利差拡大を意識か,東京外国為替市場では、アメリカで利上げが長期化するとの見方から、日米の金利差の拡大が意識されてドルを買って円を売る動きが出て、円相場は値下がりしました。
https://www.nhk.or.jp/rss/news/cat5.xml,クリスマスにも「物価高」値上げラッシュ 年明けも7000品目超,物価高騰の中で迎えることしのクリスマス。「子どもの欲しがる物が高かったので安く買える店を探した」「物の値段が上がっても孫のための費用は削りたくない」おもちゃ専門店にプレゼントを買いに来た客からは物価の高騰を実感する声が多く聞かれました。23日に発表された、ことし11月の消費者物価指数は、生鮮食品を除いた指数が去年の同じ月より3.7％上昇しました。上昇率は1981年12月以来、40年11か月ぶりの水準となります。この“値上げラッシュ” 、年が明けても続く見込みです。来年、値上げが予定される食品や飲料は7000品目を超えたことが信用調査会社の調査でわかりました。
https://www.nhk.or.jp/rss/news/cat5.xml,税制改正大綱を閣議決定 防衛力の必要財源に増税実施盛り込む,政府は、自民・公明両党が今月16日にまとめた来年度の税制改正大綱を23日、閣議決定しました。
https://www.nhk.or.jp/rss/news/cat5.xml,“あすから1週間 電力の安定供給を確保” 経済産業省,強い冬型の気圧配置の影響で、北日本から西日本の日本海側などで雪が強まる中、経済産業省は24日から1週間の電力需給の見通しを発表し、いずれの日も安定供給を確保できるとしています。
https://www.nhk.or.jp/rss/news/cat5.xml,個人のFX取引額 初の1京円突破 来年は？【経済コラム】,個人投資家が外国の通貨を売買するFX＝外国為替証拠金取引。金融先物取引業協会によると、ことし1月から11月までの合計で、年間の取引額として初めて1京円を超えました。1京というと想像もつきませんが、10000000000000000円と1のあとに0が16個続く数字です。それではお金の1京円がどのくらいすごい金額かというと1万円札を1兆枚並べた金額で、これを積み重ねると、高さは10万キロメートル、距離にすると地球2周半に及びます。ことし空前の活況を呈したFX取引。12月20日に日銀が金融緩和を修正するなど足元で環境が大きく変わる中、来年のFX取引がどうなるのか展望します。（経済部記者 仲沢啓）
https://www.nhk.or.jp/rss/news/cat5.xml,マイナンバーカードの申請手続き 郵便局で来月から支援へ,日本郵便は、マイナンバーカードの普及を後押しするため、全国およそ2300の郵便局で申請手続きを支援するサービスを始めることになりました。
https://www.nhk.or.jp/rss/news/cat5.xml,デパート11月売り上げ 前年同月比4.5％増 9か月連続プラス,全国のデパートの先月の売り上げは4692億円余りで、既存店どうしの比較では前の年の同じ月を4.5％上回って、9か月連続のプラスとなりました。
https://www.nhk.or.jp/rss/news/cat5.xml,株価 一時400円以上下落 米金融引き締め長期化で景気減速懸念,23日の東京株式市場では、アメリカ経済の底堅さを背景に金融引き締めが長期化するとの見方からアメリカの景気が減速することへの懸念が一段と強まりました。このため多くの銘柄に売り注文が広がり、日経平均株価は一時、400円以上値下がりしました。
https://www.nhk.or.jp/rss/news/cat5.xml,東京海上日動あんしん生命保険の元社員 約3億8000万円を詐取,「東京海上日動あんしん生命保険」は、営業を担当していた元社員が、顧客に無断で保険を解約し、その際に支払われる返戻金を、みずからの知人の口座に入金する手口で、顧客から合わせておよそ3億8000万円をだまし取っていたと発表しました。
https://www.nhk.or.jp/rss/news/cat5.xml,日銀 10月金融政策決定会合で“政策変更は好循環妨げる”指摘,日銀がことし10月に開いた金融政策決定会合で、政策委員から、政策の変更は物価と賃金の好循環を妨げるリスクがあるといった指摘が相次いでいたことがわかりました。ただ、日銀は今月20日の会合で、一転して金融緩和策の修正を決めていて、修正の理由などについて丁寧な説明が求められることになりそうです。
